{
  "image": "AutoTile_GrassV3.png",
  "tile_size": [
    16,
    16
  ],
  "color_mode": "palette_indexed",
  "palette": "swamp_16",
  "tiles": {
    "object_4": {
      "position": [
        0,
        1
      ],
      "properties": {
        "solid": false,
        "trigger": false
      }
    },
    "object_2": {
      "position": [
        2,
        0
      ],
      "properties": {
        "solid": false,
        "trigger": false
      }
    },
    "object_5": {
      "position": [
        1,
        1
      ],
      "properties": {
        "solid": false,
        "trigger": false
      }
    },
    "object_6": {
      "position": [
        2,
        1
      ],
      "properties": {
        "solid": false,
        "trigger": false
      }
    },
    "object_11": {
      "position": [
        3,
        2
      ],
      "properties": {
        "solid": false,
        "trigger": false
      }
    },
    "object_10": {
      "position": [
        2,
        2
      ],
      "properties": {
        "solid": false,
        "trigger": false
      }
    },
    "object_7": {
      "position": [
        3,
        1
      ],
      "properties": {
        "solid": false,
        "trigger": false
      }
    },
    "object_14": {
      "position": [
        2,
        3
      ],
      "properties": {
        "solid": false,
        "trigger": false
      }
    },
    "object_1": {
      "position": [
        1,
        0
      ],
      "properties": {
        "solid": false,
        "trigger": false
      }
    },
    "object_12": {
      "position": [
        0,
        3
      ],
      "properties": {
        "solid": false,
        "trigger": false
      }
    },
    "object_13": {
      "position": [
        1,
        3
      ],
      "properties": {
        "solid": false,
        "trigger": false
      }
    },
    "object_15": {
      "position": [
        3,
        3
      ],
      "properties": {
        "solid": false,
        "trigger": false
      }
    },
    "object_0": {
      "position": [
        0,
        0
      ],
      "properties": {
        "solid": false,
        "trigger": false
      }
    },
    "object_8": {
      "position": [
        0,
        2
      ],
      "properties": {
        "solid": false,
        "trigger": false
      }
    },
    "object_9": {
      "position": [
        1,
        2
      ],
      "properties": {
        "solid": false,
        "trigger": false
      }
    },
    "object_3": {
      "position": [
        3,
        0
      ],
      "properties": {
        "solid": false,
        "trigger": false
      }
    }
  }
}